{
  "score": 2,
  "max": 3,
  "passed": [
    "csp_strict",
    "e2e_smoke"
  ],
  "failed": [
    "no_secrets_in_dist"
  ],
  "details": {
    "csp_strict": {
      "passed": true,
      "reason": "no high-severity CSP issues found"
    },
    "no_secrets_in_dist": {
      "passed": false,
      "reason": "2 likely JWT-like tokens found in dist"
    },
    "e2e_smoke": {
      "passed": true,
      "reason": "no failed tests reported"
    }
  }
}
